{
  "$schema": "https://json-schema.org/draft/2020-12/schema",
  "$id": "pelham/elections.schema.json",
  "title": "Elections, races and candidates",
  "description": "The #elections section: three race blocks holding fourteen candidates at the time of the audit. Candidates are a FLAT top-level array joined to races by race_id, not nested inside races, so a person who is both a sitting official and a candidate (Kristen Burke) is described once.",
  "type": "object",
  "additionalProperties": false,
  "required": [
    "election_date",
    "races",
    "candidates"
  ],
  "properties": {
    "$schema": {
      "type": "string",
      "description": "Relative path to this schema file."
    },
    "election_date": {
      "type": "string",
      "description": "Election day (YYYY-MM-DD). ONE value for the whole file -- the audit found this date written out in four places. Every rendering derives from here."
    },
    "polling_hours": {
      "type": [
        "string",
        "null"
      ],
      "description": "e.g. '6am - 9pm'. Shown in the voter info row."
    },
    "editorial_note": {
      "type": "string",
      "description": "The gold non-endorsement box above the races. Safe HTML subset."
    },
    "voter_info": {
      "type": "array",
      "description": "The three boxes below the races (Election Date / Register to Vote / Where to Vote). PAGE-LEVEL, not per-race: there is one row serving all three races, and nesting it under each race would create three copies of one fact.",
      "items": {
        "type": "object",
        "additionalProperties": false,
        "required": [
          "label",
          "value"
        ],
        "properties": {
          "label": {
            "type": "string",
            "description": "Box heading, e.g. 'Where to Vote'."
          },
          "value": {
            "type": "string",
            "description": "The large figure or phrase, e.g. '6am - 9pm'. May contain {{fact:<id>}} tokens."
          },
          "note": {
            "type": [
              "string",
              "null"
            ],
            "description": "Small print under the value. Safe HTML subset -- these carry links and phone numbers."
          }
        }
      }
    },
    "debates": {
      "type": "object",
      "additionalProperties": false,
      "description": "The Candidate Debates block at the top of the elections page, the debate line in the home banner, and the debates paragraph of the AI prompt. Dates, times and places are NOT written here: each event points at a facts.json entry whose display carries them, so the page, the banner and the prompt cannot disagree.",
      "required": [
        "title",
        "intro",
        "questions_url",
        "source_url",
        "source_label",
        "hide_after",
        "events"
      ],
      "properties": {
        "title": {
          "type": "string"
        },
        "intro": {
          "type": "string",
          "description": "Safe HTML subset."
        },
        "organizer_url": {
          "type": [
            "string",
            "null"
          ],
          "description": "The organizer's site, where any remote-meeting link will be posted."
        },
        "questions_url": {
          "type": "string",
          "description": "Where residents submit questions for the debates."
        },
        "source_url": {
          "type": "string"
        },
        "source_label": {
          "type": "string"
        },
        "hide_after": {
          "type": "string",
          "description": "YYYY-MM-DD, the last debate. app.js removes the block and the banner line after this day, so they need no rebuild to retire."
        },
        "events": {
          "type": "array",
          "description": "DISPLAY ORDER IS ARRAY ORDER.",
          "items": {
            "type": "object",
            "additionalProperties": false,
            "required": [
              "race_id",
              "title",
              "fact_ref"
            ],
            "properties": {
              "race_id": {
                "type": "string",
                "description": "A races[].id; the card links to that race's panel."
              },
              "title": {
                "type": "string",
                "description": "e.g. 'Town Clerk'. Also used in the pre-filled Ask Pelham question."
              },
              "fact_ref": {
                "type": "string",
                "description": "facts.json id. Its display is the when-and-where line, its value (YYYY-MM-DD) the date used in the Ask Pelham question, and its qualifier the matchup."
              },
              "summary_unavailable": {
                "type": [
                  "object",
                  "null"
                ],
                "additionalProperties": false,
                "required": [
                  "note",
                  "recording_url"
                ],
                "description": "Optional. Shown under the debate card when no debate summary can be written (e.g. the recording could not be transcribed). The build fails if the debate also has a debate_summary.",
                "properties": {
                  "note": {
                    "type": "string",
                    "description": "Why there is no summary. The page adds 'Watch the full recording:' and the link."
                  },
                  "recording_url": {
                    "type": "string"
                  }
                }
              }
            }
          }
        }
      }
    },
    "races": {
      "type": "array",
      "description": "DISPLAY ORDER IS ARRAY ORDER.",
      "items": {
        "$ref": "#/$defs/race"
      }
    },
    "candidates": {
      "type": "array",
      "description": "All candidates across all races. Rendered grouped by race_id then party_style, in array order within each group.",
      "items": {
        "$ref": "#/$defs/candidate"
      }
    },
    "profile_methodology": {
      "type": "string",
      "description": "Rendered once, above the races: how to read a thin profile. Separate from editorial_note, which is the non-endorsement statement."
    }
  },
  "$defs": {
    "race": {
      "type": "object",
      "additionalProperties": false,
      "required": [
        "id",
        "body",
        "title",
        "seats",
        "term_length"
      ],
      "properties": {
        "id": {
          "type": "string",
          "pattern": "^[a-z0-9]+(-[a-z0-9]+)*$",
          "description": "Stable slug, the join target for candidate.race_id."
        },
        "body": {
          "type": "string",
          "description": "Foreign key to bodies.json id. Supplies the governing body name printed on the race header."
        },
        "title": {
          "type": "string",
          "description": "Office(s) contested, e.g. 'Board of Trustees' or 'Town Supervisor & Town Clerk'. A race block may cover two offices -- see candidate.office."
        },
        "seats": {
          "type": "integer",
          "minimum": 1,
          "description": "Number of seats up. Drives the 'top N vote-getters win' line."
        },
        "term_length": {
          "type": "string",
          "description": "e.g. '2-year terms'. Printed in the race meta line."
        },
        "badge": {
          "type": [
            "string",
            "null"
          ],
          "description": "The pill on the right of the race header: 'First contested race since 2019', 'Re-run required by new state law'."
        },
        "note": {
          "type": [
            "string",
            "null"
          ],
          "description": "Optional explanatory box above the candidate grid. Only the Town race uses one today, for the state-law change forcing a re-run. Safe HTML subset."
        },
        "context": {
          "type": [
            "string",
            "null"
          ],
          "description": "The 'Context:' paragraph below the grid -- retirements, prior margins, how the seats are decided. Safe HTML subset plus {{fact:<id>}} tokens."
        },
        "show_seats": {
          "type": "boolean",
          "default": true,
          "description": "Whether to print the seat count in the race meta line. False for a race block covering two different offices (Town Supervisor and Town Clerk), where a combined seat count is meaningless and the page has never shown one."
        },
        "debate_summary": {
          "type": [
            "array",
            "null"
          ],
          "description": "Optional. Manually written, AI-assisted summaries of a debate in this race, organized by topic. Each is shown under its own debate card in the Candidate Debates block, collapsed behind 'View debate summary', and given to the AI prompt. Matched to a debates.events entry by race and date, and by title as well when this race holds two debates that day (Town Clerk and Town Supervisor share a race); the build fails if a summary matches no debate. The page adds the AI-generated disclaimer and the recording link itself, so they cannot be left off. Omit or leave null until a debate has been transcribed.",
          "items": {
            "type": "object",
            "additionalProperties": false,
            "required": [
              "title",
              "date",
              "recording_url",
              "topics"
            ],
            "properties": {
              "title": {
                "type": "string",
                "description": "Which debate, e.g. 'Village of Pelham Manor Board of Trustees'. Used in the recording link, and to tell apart two debates in one race on the same day (it must then equal the debates.events title)."
              },
              "date": {
                "type": "string",
                "pattern": "^[0-9]{4}-[0-9]{2}-[0-9]{2}$",
                "description": "Debate date, YYYY-MM-DD."
              },
              "recording_url": {
                "type": "string",
                "description": "The full debate recording, linked from the disclaimer."
              },
              "topics": {
                "type": "array",
                "minItems": 1,
                "description": "DISPLAY ORDER IS ARRAY ORDER. Group what candidates said by subject. List a candidate under a topic only if they spoke to it, and keep related points from both sides under the same topic.",
                "items": {
                  "type": "object",
                  "additionalProperties": false,
                  "required": [
                    "topic",
                    "positions"
                  ],
                  "properties": {
                    "topic": {
                      "type": "string",
                      "description": "Subheading, e.g. 'Fiscal management and taxes'."
                    },
                    "positions": {
                      "type": "array",
                      "minItems": 1,
                      "description": "One entry per candidate who spoke to this topic. Each candidate_id must be in this race; the build fails otherwise.",
                      "items": {
                        "type": "object",
                        "additionalProperties": false,
                        "required": [
                          "candidate_id",
                          "point"
                        ],
                        "properties": {
                          "candidate_id": {
                            "type": "string"
                          },
                          "point": {
                            "type": "string",
                            "description": "One sentence attributed in the candidate's voice, starting with a neutral verb ('Says', 'Argued', 'Noted', 'Proposed'). Never stated as fact, and no loaded verbs ('claimed', 'insisted', 'correctly noted'). Safe HTML subset; {{fact:}} tokens allowed."
                          }
                        }
                      }
                    }
                  }
                }
              }
            }
          }
        }
      }
    },
    "candidate": {
      "type": "object",
      "additionalProperties": false,
      "required": [
        "id",
        "race_id",
        "name",
        "party",
        "party_style",
        "profile",
        "source_url",
        "source_label"
      ],
      "properties": {
        "id": {
          "type": "string",
          "pattern": "^[a-z0-9]+(-[a-z0-9]+)*$",
          "description": "Stable slug. Where the candidate is also a sitting official, use the same slug as their officials.json entry."
        },
        "race_id": {
          "type": "string",
          "description": "Foreign key to a races[].id. Build fails on a dangling reference."
        },
        "office": {
          "type": [
            "string",
            "null"
          ],
          "description": "Which seat this person seeks, e.g. 'Town Supervisor' or 'Town Clerk'. REQUIRED in practice for the Town race, whose single block contains two different offices; null where the race has only one."
        },
        "name": {
          "type": "string",
          "description": "Candidate name as reported."
        },
        "party": {
          "type": "string",
          "description": "Party line as DISPLAYED, e.g. 'Neighborhood Party . Republican' or 'Neighborhood Party'. Free text: the same styling is used for both of those labels."
        },
        "party_style": {
          "enum": [
            "dem",
            "nbhd"
          ],
          "description": "Column colour only; renders as CSS class .party-label.<value>. Separate from party for the same reason issue tags split label from style."
        },
        "incumbent": {
          "type": "boolean",
          "default": false,
          "description": "Whether they currently hold the seat. Lets the build render a consistent badge instead of relying on the meta line saying so."
        },
        "meta": {
          "type": "string",
          "description": "The one-line credential strip under the name: 'Incumbent . First elected 2020 . Running for third term'."
        },
        "no_statement_as_of": {
          "type": "string",
          "pattern": "^[0-9]{4}-[0-9]{2}-[0-9]{2}$",
          "description": "Optional ISO date. Set when the candidate has published no campaign statement as of that date: the empty 'Why they say they're running' slot then reads 'No campaign statement has been published as of <date>.' in the muted not-found style, so a thin profile reads as a checked gap rather than an oversight. The build fails if this is set while why_running has content -- remove it once a statement is published."
        },
        "source_url": {
          "type": "string",
          "description": "Link to the reporting this profile is drawn from."
        },
        "source_label": {
          "type": "string",
          "description": "Link text, e.g. 'Examiner September 4, 2026'."
        },
        "profile": {
          "type": "object",
          "additionalProperties": false,
          "description": "The six-slot profile every candidate is rendered through, in a fixed order, so no candidate gets a longer or more favourable shape than another. A slot the public record does not fill is null and renders as an explicit \"not found\" line rather than being silently dropped -- an absent slot must read as a gap in the record, not as a judgement about the campaign. The sixth slot, Source, is source_url plus source_label.",
          "required": [
            "background",
            "why_running",
            "prior_service",
            "priorities",
            "quotes"
          ],
          "properties": {
            "background": {
              "type": "string",
              "description": "Who they are and what they do. Safe HTML subset plus {{fact:<id>}} tokens."
            },
            "why_running": {
              "type": [
                "string",
                "null"
              ],
              "description": "Their stated reason for running, always attributed to them (\"he says\", \"she argues\") so the site never adopts a candidate rationale as its own voice. Null where no statement of intent exists in the public record."
            },
            "prior_service": {
              "type": [
                "string",
                "null"
              ],
              "description": "Elected or appointed public service. The literal string \"No prior elected office.\" where there is none -- never null, because an empty slot here would read as missing research rather than as a fact about the candidate."
            },
            "priorities": {
              "type": [
                "array",
                "null"
              ],
              "items": {
                "type": "string"
              },
              "description": "Stated campaign priorities, one per item. Where several candidates signed one joint platform they each carry its pledges, which is accurate: they each signed it."
            },
            "quotes": {
              "type": [
                "array",
                "null"
              ],
              "items": {
                "type": "string"
              },
              "description": "Direct quotes from the public record, verbatim. Null where the record carries none."
            }
          }
        }
      }
    }
  }
}
