{
  "$schema": "./schema/elections.schema.json",
  "election_date": "2026-11-03",
  "polling_hours": "6am - 9pm",
  "editorial_note": "<strong style=\"color: var(--gold-light);\">This site does not endorse any candidate or party.</strong> Candidate profiles are drawn from candidates' own statements as published in the Pelham Examiner and other publicly available information. All candidates in each race are presented using the same template. The amount of information shown reflects the public record available at time of publishing and does not indicate the importance or strength of a candidate's campaign. Register to vote by {{fact:voter-registration-deadline}} — see <a href=\"/about\" style=\"color: var(--gold-light);\">how this site works</a>.",
  "voter_info": [
    {
      "label": "Election Day",
      "value": "{{fact:election-date-2026.short}}",
      "note": "Polls open {{fact:polling-hours}}."
    },
    {
      "label": "Register by",
      "value": "{{fact:voter-registration-deadline.short}}",
      "note": "In person or online by October 24. By mail, postmarked by October 19 and received by October 24. <a href=\"https://elections.ny.gov/registration-and-voting-deadlines\" target=\"_blank\" style=\"color: var(--gold-light);\">Deadlines at elections.ny.gov</a>"
    },
    {
      "label": "Early voting",
      "value": "{{fact:early-voting-2026.short}}",
      "note": "Saturday October 24 through Sunday November 1. Hours and sites: <a href=\"https://www.westchestercountyny.gov/boe\" target=\"_blank\" style=\"color: var(--gold-light);\">Westchester County Board of Elections</a>"
    },
    {
      "label": "Where to vote",
      "value": "Look it up",
      "note": "Polling places move between elections, so check yours rather than trusting last time: <a href=\"https://voterlookup.elections.ny.gov\" target=\"_blank\" style=\"color: var(--gold-light);\">voterlookup.elections.ny.gov</a>. Voting by mail? Apply for an absentee or early mail ballot at <a href=\"https://elections.ny.gov/registration-and-voting-deadlines\" target=\"_blank\" style=\"color: var(--gold-light);\">elections.ny.gov</a>."
    }
  ],
  "debates": {
    "title": "Candidate Debates",
    "intro": "The League of Women Voters has scheduled four candidate debates, one for each race. The questions come from residents: the League vets those submitted and picks a range covering different topics.",
    "organizer_url": "https://lwvw.org/",
    "questions_url": "https://docs.google.com/forms/d/e/1FAIpQLSdn8lKg4sN8vTWCgAzLbVqDh3VewA1l114OvqWX24Ul-lWLVw/viewform",
    "source_url": "https://pelhamexaminer.com/85185/latest-news/after-weeks-of-negotiations-pelham-candidates-agree-to-4-league-of-women-voters-debates-submit-your-questions-now/",
    "source_label": "Pelham Examiner, October 17, 2026",
    "hide_after": "2026-10-28",
    "events": [
      {
        "race_id": "pelham-manor-trustees",
        "title": "Pelham Manor Board of Trustees",
        "fact_ref": "debate-manor-trustees"
      },
      {
        "race_id": "town-supervisor-and-clerk",
        "title": "Town Clerk",
        "fact_ref": "debate-town-clerk"
      },
      {
        "race_id": "town-supervisor-and-clerk",
        "title": "Town Supervisor",
        "fact_ref": "debate-town-supervisor"
      },
      {
        "race_id": "village-of-pelham-trustees",
        "title": "Village of Pelham Board of Trustees",
        "fact_ref": "debate-village-trustees"
      }
    ]
  },
  "races": [
    {
      "id": "village-of-pelham-trustees",
      "body": "village-of-pelham",
      "title": "Board of Trustees",
      "seats": 3,
      "term_length": "2-year terms",
      "badge": "First contested race since 2019",
      "note": null,
      "context": "<strong>Context:</strong> Hanan Eldahry, who has served since 2018, is not seeking reelection. Fiscal management is a major issue discussed by candidates and covered in local reporting — the village passed a {{fact:village-budget-fy2627}} budget with a {{fact:village-budget-increase-fy2627}} increase, overriding the state tax cap for the first time. Three seats are up; top three vote-getters win."
    },
    {
      "id": "pelham-manor-trustees",
      "body": "village-of-pelham-manor",
      "title": "Board of Trustees",
      "seats": 2,
      "term_length": "2-year terms",
      "badge": "Contested",
      "note": null,
      "context": "<strong>Context:</strong> Maurice Owen-Michaane is stepping down after three two-year terms. The 2025 Manor election was historically close — Lapey won the mayoral race by 20 votes, Case won by 2 after a recount. Kurtz returns for a rematch. Top two vote-getters win."
    },
    {
      "id": "town-supervisor-and-clerk",
      "body": "town-of-pelham",
      "title": "Town Supervisor & Town Clerk",
      "seats": 2,
      "term_length": "2-year terms",
      "badge": "Re-run required by new state law",
      "note": "A new state law shifts odd-year municipal elections to even years. As a result, Supervisor Mohan and Clerk Miller — both elected in November 2025 — must run again in 2026 to secure full two-year terms.",
      "context": "<strong>Context:</strong> Mohan defeated Republican Dan McLaughlin 2,115 to 1,456 in 2025. Miller defeated Borsella 2,108 to 1,457. Both races were decided by similar margins. Town Council seats (Burke, McLoughlin, Jenks, Curtin — 4-year terms) are not up in 2026.",
      "show_seats": false
    }
  ],
  "candidates": [
    {
      "id": "russell-solomon",
      "race_id": "village-of-pelham-trustees",
      "office": null,
      "name": "Russell Solomon",
      "party": "Democratic Party",
      "party_style": "dem",
      "incumbent": true,
      "meta": "Incumbent · First elected 2020 · Completing third term",
      "source_url": "https://pelhamexaminer.com/84934/showcase/russell-solomons-campaign-statement-the-trust-you-give-only-means-something-if-its-followed-by-the-work/",
      "source_label": "Campaign statement — Examiner October 2, 2026",
      "profile": {
        "background": "A Village of Pelham trustee for six years, first elected in 2020 and now completing his third term. Professionally he is Executive Creative Director at a national firm; he moved to Pelham in 2007 and has raised three children here. As the board&rsquo;s liaison to the Police Department he pushed for a dedicated Traffic Officer in the village budget, and he cites lowering the village speed limit to 25 mph, redesigning the Wolfs Lane and Sparks Avenue intersection, and the school zone speed camera home rule the Governor signed in August 2026. He says that after he joined the board during COVID, with village revenues in freefall, the board restored the village&rsquo;s finances and earned an AA+ credit rating from S&amp;P Global. He also points to relining 10% of the village&rsquo;s sanitary sewers and bringing sanitation in-house to DPW.",
        "why_running": "He says the trust residents give &ldquo;only means something if it&rsquo;s followed through with collaborative work and results.&rdquo; He calls stormwater remediation a priority, citing residents who have repeatedly seen their basements flood. He notes that this is the first contested Village Trustee election since 2019, and he is running alongside fellow incumbent Krystal Howell and Kristen Burke.",
        "prior_service": "Village of Pelham Board of Trustees, 2020 to present.",
        "priorities": [
          "Pedestrian safety and traffic calming",
          "Fiscal management",
          "Sewer and infrastructure repair",
          "Stormwater remediation",
          "Responds to the Neighborhood Party debt projection: says no bond has been authorized and the $48.5M figure is an evolving estimate, not committed debt. (pelhamexaminer.com/84941, October 2, 2026)"
        ],
        "quotes": [
          "The trust you give only means something if it&rsquo;s followed by the work.",
          "I&rsquo;ve been fortunate not to experience severe flooding, but I know plenty of Pelham residents who&rsquo;ve watched water fill their basements more than once, who&rsquo;ve drained their savings trying to keep their homes livable, and who&rsquo;ve had to gut and rebuild rooms they&rsquo;d already rebuilt once before."
        ]
      }
    },
    {
      "id": "krystal-howell",
      "race_id": "village-of-pelham-trustees",
      "office": null,
      "name": "Krystal Howell",
      "party": "Democratic Party",
      "party_style": "dem",
      "incumbent": true,
      "meta": "Incumbent · First elected 2024",
      "source_url": "https://pelhamexaminer.com/84889/showcase/krystal-howells-campaign-statement-my-love-for-this-village-runs-deep-and-so-does-my-commitment-to-serving-every-resident-with-respect-and-empathy/",
      "source_label": "Campaign statement — Examiner September 30, 2026",
      "profile": {
        "background": "Finishing her first term as a Village of Pelham trustee, first elected in 2024. She is a CPA with 25 years of experience in the energy sector, covering construction and project management, contractor oversight, budgeting and financial planning, safety and environmental compliance, and capital program management; she says she has managed large portfolios and supported work exceeding $2 billion a year. As trustee she supported pedestrian safety efforts including the hiring of a Traffic Safety Officer, advocated for the village with other levels of government, and worked with neighboring municipalities on shared quality-of-life issues. Before joining the board she was PTA Council President and served on local PTA boards, the Pelham Together Diversity Committee, the school district&rsquo;s Cultural Competency Committee, Bridges of Pelham and the Village Steering Committee on Police Reform, and started free drop-in math tutoring at the high school after COVID.",